{
  "category": "api",
  "nameKo": "API",
  "fetchedAt": "2026-10-20",
  "total": 11726,
  "subcategories": [
    {
      "id": "ai-llm",
      "nameKo": "AI 언어 모델",
      "count": 68,
      "sources": [
        {
          "id": "models-dev",
          "name": "models.dev (AI model providers)",
          "count": 55
        },
        {
          "id": "official",
          "name": "공식 문서에서 확인한 API (코드잇소 손 목록)",
          "count": 7
        },
        {
          "id": "openrouter",
          "name": "OpenRouter providers (AI inference companies)",
          "count": 6
        }
      ]
    },
    {
      "id": "ai-inference",
      "nameKo": "AI 모델 호스팅·라우터",
      "count": 209,
      "sources": [
        {
          "id": "models-dev",
          "name": "models.dev (AI model providers)",
          "count": 176
        },
        {
          "id": "official",
          "name": "공식 문서에서 확인한 API (코드잇소 손 목록)",
          "count": 8
        },
        {
          "id": "openrouter",
          "name": "OpenRouter providers (AI inference companies)",
          "count": 25
        }
      ]
    },
    {
      "id": "ai-image",
      "nameKo": "AI 이미지·영상·3D",
      "count": 35,
      "sources": [
        {
          "id": "official",
          "name": "공식 문서에서 확인한 API (코드잇소 손 목록)",
          "count": 34
        },
        {
          "id": "openrouter",
          "name": "OpenRouter providers (AI inference companies)",
          "count": 1
        }
      ]
    },
    {
      "id": "ai-audio",
      "nameKo": "AI 음성·음악",
      "count": 33,
      "sources": [
        {
          "id": "official",
          "name": "공식 문서에서 확인한 API (코드잇소 손 목록)",
          "count": 33
        }
      ]
    },
    {
      "id": "ai-embeddings",
      "nameKo": "AI 임베딩·리랭크",
      "count": 8,
      "sources": [
        {
          "id": "official",
          "name": "공식 문서에서 확인한 API (코드잇소 손 목록)",
          "count": 8
        }
      ]
    },
    {
      "id": "ai-search",
      "nameKo": "AI용 검색·웹 수집",
      "count": 25,
      "sources": [
        {
          "id": "official",
          "name": "공식 문서에서 확인한 API (코드잇소 손 목록)",
          "count": 25
        }
      ]
    },
    {
      "id": "ai-vision",
      "nameKo": "AI 비전·문서·번역",
      "count": 29,
      "sources": [
        {
          "id": "official",
          "name": "공식 문서에서 확인한 API (코드잇소 손 목록)",
          "count": 29
        }
      ]
    },
    {
      "id": "ai-other",
      "nameKo": "그 밖의 AI·머신러닝",
      "count": 95,
      "sources": [
        {
          "id": "apis-guru",
          "name": "APIs.guru OpenAPI Directory",
          "count": 10
        },
        {
          "id": "marcelscruz",
          "name": "Public APIs (marcelscruz)",
          "count": 31
        },
        {
          "id": "official",
          "name": "공식 문서에서 확인한 API (코드잇소 손 목록)",
          "count": 3
        },
        {
          "id": "public-api-lists",
          "name": "Public API Lists",
          "count": 6
        },
        {
          "id": "public-apis",
          "name": "public-apis",
          "count": 45
        }
      ]
    },
    {
      "id": "kr-public",
      "nameKo": "한국 공공데이터",
      "count": 5385,
      "sources": [
        {
          "id": "data-go-kr",
          "name": "공공데이터포털 오픈API",
          "count": 5183
        },
        {
          "id": "official",
          "name": "공식 문서에서 확인한 API (코드잇소 손 목록)",
          "count": 4
        },
        {
          "id": "public-apis-4kr",
          "name": "public-apis-4Kr (한국 공개 API 목록)",
          "count": 198
        }
      ]
    },
    {
      "id": "kr-dev",
      "nameKo": "한국 개발자 API",
      "count": 114,
      "sources": [
        {
          "id": "official",
          "name": "공식 문서에서 확인한 API (코드잇소 손 목록)",
          "count": 16
        },
        {
          "id": "public-apis-4kr",
          "name": "public-apis-4Kr (한국 공개 API 목록)",
          "count": 98
        }
      ]
    },
    {
      "id": "open-data",
      "nameKo": "공공·과학 데이터",
      "count": 637,
      "sources": [
        {
          "id": "apis-guru",
          "name": "APIs.guru OpenAPI Directory",
          "count": 295
        },
        {
          "id": "graphql-apis",
          "name": "Public GraphQL APIs (APIs.guru)",
          "count": 3
        },
        {
          "id": "marcelscruz",
          "name": "Public APIs (marcelscruz)",
          "count": 40
        },
        {
          "id": "public-api-lists",
          "name": "Public API Lists",
          "count": 34
        },
        {
          "id": "public-apis",
          "name": "public-apis",
          "count": 265
        }
      ]
    },
    {
      "id": "maps",
      "nameKo": "지도·위치·교통",
      "count": 420,
      "sources": [
        {
          "id": "apis-guru",
          "name": "APIs.guru OpenAPI Directory",
          "count": 97
        },
        {
          "id": "graphql-apis",
          "name": "Public GraphQL APIs (APIs.guru)",
          "count": 9
        },
        {
          "id": "marcelscruz",
          "name": "Public APIs (marcelscruz)",
          "count": 37
        },
        {
          "id": "official",
          "name": "공식 문서에서 확인한 API (코드잇소 손 목록)",
          "count": 9
        },
        {
          "id": "public-api-lists",
          "name": "Public API Lists",
          "count": 41
        },
        {
          "id": "public-apis",
          "name": "public-apis",
          "count": 227
        }
      ]
    },
    {
      "id": "weather",
      "nameKo": "날씨·환경",
      "count": 108,
      "sources": [
        {
          "id": "apis-guru",
          "name": "APIs.guru OpenAPI Directory",
          "count": 3
        },
        {
          "id": "graphql-apis",
          "name": "Public GraphQL APIs (APIs.guru)",
          "count": 1
        },
        {
          "id": "marcelscruz",
          "name": "Public APIs (marcelscruz)",
          "count": 16
        },
        {
          "id": "public-api-lists",
          "name": "Public API Lists",
          "count": 13
        },
        {
          "id": "public-apis",
          "name": "public-apis",
          "count": 75
        }
      ]
    },
    {
      "id": "finance",
      "nameKo": "금융·암호화폐·환율",
      "count": 454,
      "sources": [
        {
          "id": "apis-guru",
          "name": "APIs.guru OpenAPI Directory",
          "count": 72
        },
        {
          "id": "graphql-apis",
          "name": "Public GraphQL APIs (APIs.guru)",
          "count": 1
        },
        {
          "id": "marcelscruz",
          "name": "Public APIs (marcelscruz)",
          "count": 96
        },
        {
          "id": "public-api-lists",
          "name": "Public API Lists",
          "count": 50
        },
        {
          "id": "public-apis",
          "name": "public-apis",
          "count": 235
        }
      ]
    },
    {
      "id": "payments",
      "nameKo": "결제·쇼핑",
      "count": 232,
      "sources": [
        {
          "id": "apis-guru",
          "name": "APIs.guru OpenAPI Directory",
          "count": 166
        },
        {
          "id": "graphql-apis",
          "name": "Public GraphQL APIs (APIs.guru)",
          "count": 11
        },
        {
          "id": "marcelscruz",
          "name": "Public APIs (marcelscruz)",
          "count": 12
        },
        {
          "id": "official",
          "name": "공식 문서에서 확인한 API (코드잇소 손 목록)",
          "count": 12
        },
        {
          "id": "public-api-lists",
          "name": "Public API Lists",
          "count": 3
        },
        {
          "id": "public-apis",
          "name": "public-apis",
          "count": 28
        }
      ]
    },
    {
      "id": "messaging",
      "nameKo": "이메일·문자·메신저",
      "count": 185,
      "sources": [
        {
          "id": "apis-guru",
          "name": "APIs.guru OpenAPI Directory",
          "count": 93
        },
        {
          "id": "marcelscruz",
          "name": "Public APIs (marcelscruz)",
          "count": 27
        },
        {
          "id": "official",
          "name": "공식 문서에서 확인한 API (코드잇소 손 목록)",
          "count": 21
        },
        {
          "id": "public-apis",
          "name": "public-apis",
          "count": 44
        }
      ]
    },
    {
      "id": "auth-security",
      "nameKo": "로그인·보안",
      "count": 168,
      "sources": [
        {
          "id": "apis-guru",
          "name": "APIs.guru OpenAPI Directory",
          "count": 27
        },
        {
          "id": "graphql-apis",
          "name": "Public GraphQL APIs (APIs.guru)",
          "count": 1
        },
        {
          "id": "marcelscruz",
          "name": "Public APIs (marcelscruz)",
          "count": 28
        },
        {
          "id": "official",
          "name": "공식 문서에서 확인한 API (코드잇소 손 목록)",
          "count": 16
        },
        {
          "id": "public-api-lists",
          "name": "Public API Lists",
          "count": 14
        },
        {
          "id": "public-apis",
          "name": "public-apis",
          "count": 82
        }
      ]
    },
    {
      "id": "dev",
      "nameKo": "개발 도구",
      "count": 772,
      "sources": [
        {
          "id": "apis-guru",
          "name": "APIs.guru OpenAPI Directory",
          "count": 219
        },
        {
          "id": "graphql-apis",
          "name": "Public GraphQL APIs (APIs.guru)",
          "count": 27
        },
        {
          "id": "marcelscruz",
          "name": "Public APIs (marcelscruz)",
          "count": 113
        },
        {
          "id": "public-api-lists",
          "name": "Public API Lists",
          "count": 84
        },
        {
          "id": "public-apis",
          "name": "public-apis",
          "count": 329
        }
      ]
    },
    {
      "id": "business",
      "nameKo": "업무·생산성",
      "count": 343,
      "sources": [
        {
          "id": "apis-guru",
          "name": "APIs.guru OpenAPI Directory",